{
  "participantId": "9b2e4c7a-1f3d-4a8b-9c6e-2d5f8a1b3c4d",
  "phase": "pre",
  "role": "Backend / Go",
  "answers": [
    { "questionKey": "time_sink", "answer": "Hand-writing boilerplate for new gRPC services and their integration tests." },
    { "questionKey": "friction", "answer": "Context-switching between the codebase, docs, and Slack to figure out why a flaky test fails." },
    { "questionKey": "goal", "answer": "Leave with an agent loop that can scaffold a service and get its tests green on its own." }
  ]
}
